{
  "schema_version": "failure.v1",
  "capsule_id": "capsule-1",
  "attempt_ref": "fixture:attempt",
  "skill_version_ref": null,
  "input_refs": [
    "fixture:input"
  ],
  "environment_ref": "fixture:environment",
  "version_digest": "0000000000000000000000000000000000000000000000000000000000000000",
  "error_kind": "EFFECT_UNKNOWN",
  "observed_state": "SEND_ARMED",
  "counterexample_ref": "fixture:counterexample",
  "recovery_ref": "fixture:reconciliation",
  "evidence_refs": [
    "fixture:evidence"
  ],
  "applicability_ref": "fixture:version-1"
}
